{
  "$ref": "#/definitions/projects",
  "definitions": {
    "projects": {
      "type": "object",
      "properties": {
        "title": {
          "type": "string"
        },
        "slug": {
          "type": "string"
        },
        "summary": {
          "type": "string"
        },
        "description": {
          "type": "string"
        },
        "tech": {
          "type": "array",
          "items": {
            "type": "string"
          }
        },
        "role": {
          "type": "string"
        },
        "period": {
          "type": "string"
        },
        "highlights": {
          "type": "array",
          "items": {
            "type": "string"
          }
        },
        "link": {
          "type": "string"
        },
        "category": {
          "type": "string",
          "enum": [
            "personal",
            "academic"
          ]
        },
        "$schema": {
          "type": "string"
        }
      },
      "required": [
        "title",
        "slug",
        "summary",
        "description",
        "tech",
        "role",
        "period",
        "highlights",
        "link",
        "category"
      ],
      "additionalProperties": false
    }
  },
  "$schema": "http://json-schema.org/draft-07/schema#"
}