{
  "title": "Highly Available AWS Infrastructure",
  "slug": "aws-ha-infrastructure",
  "summary": "A highly available, scalable web application infrastructure on AWS with ALB, Auto Scaling Group, and secure multi-AZ network architecture",
  "description": "A highly available, scalable web application infrastructure on AWS with ALB, Auto Scaling Group, and secure multi-AZ network architecture.",
  "tech": [
    "AWS",
    "Terraform",
    "ALB",
    "Auto Scaling",
    "VPC",
    "EC2"
  ],
  "role": "DevOps Engineer",
  "period": "2025",
  "highlights": [
    "Multi-AZ deployment across us-east-1a and us-east-1b",
    "Application Load Balancer with health checks",
    "Auto Scaling Group (1-3 instances) based on demand",
    "Secure bastion host for SSH access to private instances"
  ],
  "link": "https://github.com/maroayman/depi-project-5",
  "category": "personal"
}